{
  "case_id": "T-001",
  "title": "The Realm v. Jon Snow",
  "fictional": true,

  "accused": "Jon Snow",
  "affected_party": "Daenerys Targaryen",
  "act_alleged": "Jon intentionally killed Daenerys by stabbing her during a private meeting in the throne room after the fall of King's Landing.",

  "background": "The story takes place mainly in Westeros, a continent where powerful families compete for the Iron Throne. Jon Snow grows up believing he is the illegitimate son of Lord Eddard Stark. He becomes a military commander, then King in the North. He later learns that he is the lawful son of Rhaegar Targaryen and Lyanna Stark. This gives him a stronger hereditary claim to the throne than Daenerys, although he does not want to rule.\n\nDaenerys Targaryen is the exiled heir of the dynasty that once ruled Westeros. She survives abuse, gains three dragons, frees enslaved people, and builds an army. Her victories make her both a liberator and an increasingly absolute ruler. Jon and Daenerys become allies and lovers while fighting the Night King, whose army threatens all living people. Jon pledges loyalty to her. After they defeat the dead, Daenerys turns to the Iron Throne. Jon's hidden parentage then weakens her political claim and feeds her fear of betrayal.\n\nDaenerys attacks King's Landing, the capital held by Queen Cersei Lannister. The city surrenders, but Daenerys burns streets and civilians from her dragon, Drogon. Jon witnesses the destruction. Grey Worm, her commander, joins the killing on the ground. Afterward, Daenerys promises further campaigns of liberation. Tyrion Lannister, her chief adviser, resigns in protest and is imprisoned. He warns Jon that Daenerys will kill anyone who threatens her rule, including Jon's sisters. Jon asks Daenerys to show mercy and share moral judgment with others. She refuses. During an embrace, he stabs her to death. Her soldiers arrest him.",

  "agreed_facts": [
    "King's Landing had surrendered: its bells rang and organized resistance had ceased. Daenerys then used Drogon against streets and civilians, causing destruction on a vast scale.",
    "After the victory, Daenerys told her assembled forces that the campaign of \"liberation\" would continue beyond King's Landing. Jon had seen the city and heard the speech.",
    "Tyrion Lannister renounced his office as Hand and was imprisoned. He warned Jon that Daenerys would treat Jon's sisters, and anyone else she regarded as an obstacle, as enemies.",
    "Jon asked Daenerys to forgive Tyrion and to show mercy. She refused to let others choose what was good and presented her own judgment as decisive.",
    "Daenerys was unarmed and was not attacking Jon when he killed her. Jon used their intimacy to get close enough to strike. He had not convened a council, attempted detention, or sought a public surrender of power."
  ],

  "issue": "Was Jon Snow's intentional killing of Daenerys Targaryen justified as the necessary defense of others and of the realm, given what he knew, the scale of the threatened harm, the absence or presence of safer alternatives, and his lack of formal authority?",

  "scope": {
    "decides": ["justified", "not_justified"],
    "imposes_sentence": false,
    "combines_opinions": false,
    "note": "The Tribunal decides justified / not justified and gives reasons. It does not impose a sentence, and it does not combine the three opinions into one verdict."
  },

  "representatives": [
    {
      "id": "jon_snow",
      "name": "Jon Snow",
      "seat": "defense",
      "brief": "Jon speaks plainly and rarely volunteers a long explanation. He dislikes praise, titles, and arguments built on his birth. Duty, kept promises, family, and protection of people who cannot defend themselves matter to him. He accepts blame quickly and can undervalue his own judgment. He answers directly, tolerates silence, admits uncertainty, and changes position when honor or evidence requires it."
    },
    {
      "id": "tyrion_lannister",
      "name": "Tyrion Lannister",
      "seat": "defense",
      "brief": "Tyrion is quick, ironic, and curious about motives and consequences. He prefers persuasion, negotiated limits, and plans that leave people alive. He mistrusts purity, inherited greatness, and rulers who cannot hear unwelcome advice. Shame, divided family loyalty, and confidence in his own cleverness can distort him. He tests every side, notices contradictions, and can revise without losing his wit."
    },
    {
      "id": "daenerys_targaryen",
      "name": "Daenerys Targaryen",
      "seat": "prosecution",
      "brief": "Daenerys speaks with command and moral intensity. She prizes liberation, courage, loyalty, and action against entrenched cruelty. She wants recognition as a legitimate ruler and reacts sharply to betrayal, condescension, or secret maneuvering. Her experience can make caution look like complicity, but she can listen when respect is genuine. She interprets the record herself, including evidence against her."
    },
    {
      "id": "grey_worm",
      "name": "Grey Worm",
      "seat": "prosecution",
      "brief": "Grey Worm is terse, concrete, and disciplined. He trusts witnessed conduct, clear orders, earned loyalty, and comrades who shared danger. Courtly rhetoric and speculative motives interest him less than sequence: who acted, what was known, and what alternatives existed. Grief and devotion can narrow his view. He speaks without flourish and alters his assessment only for strong evidence."
    }
  ],

  "provenance": {
    "source": "ASE-26 running project, case design dossier: 'The Tribunal - Jon Snow and the untimely demise of Daenerys Targaryen', research edition, Mikael Gorsky.",
    "received": "2026-08-24",
    "disclaimer": "Fictional proceeding. The judge profiles adapt judicial methods; they do not impersonate the judges and do not predict how any real court would rule."
  }
}
